{
  "worldId": "indoru-world-001",
  "name": "Indoru",
  "version": "0.1.0",
  "mapAsset": "assets/maps/indoru-transport-network.png",
  "startingCountryId": "country-001",
  "countryCount": 120,
  "temporaryMapCodes": false,
  "countries": [
    {
      "countryId": "country-001",
      "name": "Avenra",
      "displayName": "Avenra",
      "region": "Avarra Crescent",
      "regionCode": "AVR",
      "flagId": "flag-avenra",
      "flagAsset": "assets/flags/flag-avenra.svg",
      "identity": "Central river capital and trade hub",
      "regionalTheme": "warm fertile crescent, inland sea trade",
      "status": "playable",
      "unlockOrder": 1,
      "mapKey": "country/avenra",
      "peopleProfileId": "people-avenra"
    },
    {
      "countryId": "country-002",
      "name": "Solvani",
      "displayName": "Solvani",
      "region": "Avarra Crescent",
      "regionCode": "AVR",
      "flagId": "flag-solvani",
      "flagAsset": "assets/flags/flag-solvani.svg",
      "identity": "Sun-coast cities and dry hills",
      "regionalTheme": "warm fertile crescent, inland sea trade",
      "status": "playable",
      "unlockOrder": 2,
      "mapKey": "country/solvani",
      "peopleProfileId": "people-solvani"
    },
    {
      "countryId": "country-003",
      "name": "Mirqara",
      "displayName": "Mirqara",
      "region": "Avarra Crescent",
      "regionCode": "AVR",
      "flagId": "flag-mirqara",
      "flagAsset": "assets/flags/flag-mirqara.svg",
      "identity": "Inland sea ports and markets",
      "regionalTheme": "warm fertile crescent, inland sea trade",
      "status": "playable",
      "unlockOrder": 3,
      "mapKey": "country/mirqara",
      "peopleProfileId": "people-mirqara"
    },
    {
      "countryId": "country-004",
      "name": "Tavresh",
      "displayName": "Tavresh",
      "region": "Avarra Crescent",
      "regionCode": "AVR",
      "flagId": "flag-tavresh",
      "flagAsset": "assets/flags/flag-tavresh.svg",
      "identity": "Terraced farms and old fort towns",
      "regionalTheme": "warm fertile crescent, inland sea trade",
      "status": "playable",
      "unlockOrder": 4,
      "mapKey": "country/tavresh",
      "peopleProfileId": "people-tavresh"
    },
    {
      "countryId": "country-005",
      "name": "Orvessa",
      "displayName": "Orvessa",
      "region": "Avarra Crescent",
      "regionCode": "AVR",
      "flagId": "flag-orvessa",
      "flagAsset": "assets/flags/flag-orvessa.svg",
      "identity": "Western coastal republic",
      "regionalTheme": "warm fertile crescent, inland sea trade",
      "status": "playable",
      "unlockOrder": 5,
      "mapKey": "country/orvessa",
      "peopleProfileId": "people-orvessa"
    },
    {
      "countryId": "country-006",
      "name": "Narevia",
      "displayName": "Narevia",
      "region": "Avarra Crescent",
      "regionCode": "AVR",
      "flagId": "flag-narevia",
      "flagAsset": "assets/flags/flag-narevia.svg",
      "identity": "Wide delta and canal cities",
      "regionalTheme": "warm fertile crescent, inland sea trade",
      "status": "playable",
      "unlockOrder": 6,
      "mapKey": "country/narevia",
      "peopleProfileId": "people-narevia"
    },
    {
      "countryId": "country-007",
      "name": "Belqorin",
      "displayName": "Belqorin",
      "region": "Avarra Crescent",
      "regionCode": "AVR",
      "flagId": "flag-belqorin",
      "flagAsset": "assets/flags/flag-belqorin.svg",
      "identity": "Limestone highlands and quarries",
      "regionalTheme": "warm fertile crescent, inland sea trade",
      "status": "playable",
      "unlockOrder": 7,
      "mapKey": "country/belqorin",
      "peopleProfileId": "people-belqorin"
    },
    {
      "countryId": "country-008",
      "name": "Yalmera",
      "displayName": "Yalmera",
      "region": "Avarra Crescent",
      "regionCode": "AVR",
      "flagId": "flag-yalmera",
      "flagAsset": "assets/flags/flag-yalmera.svg",
      "identity": "Southern grasslands and horse culture",
      "regionalTheme": "warm fertile crescent, inland sea trade",
      "status": "playable",
      "unlockOrder": 8,
      "mapKey": "country/yalmera",
      "peopleProfileId": "people-yalmera"
    },
    {
      "countryId": "country-009",
      "name": "Kadrune",
      "displayName": "Kadrune",
      "region": "Avarra Crescent",
      "regionCode": "AVR",
      "flagId": "flag-kadrune",
      "flagAsset": "assets/flags/flag-kadrune.svg",
      "identity": "Industrial river corridor",
      "regionalTheme": "warm fertile crescent, inland sea trade",
      "status": "playable",
      "unlockOrder": 9,
      "mapKey": "country/kadrune",
      "peopleProfileId": "people-kadrune"
    },
    {
      "countryId": "country-010",
      "name": "Eshvara",
      "displayName": "Eshvara",
      "region": "Avarra Crescent",
      "regionCode": "AVR",
      "flagId": "flag-eshvara",
      "flagAsset": "assets/flags/flag-eshvara.svg",
      "identity": "Temple valleys and dense urban districts",
      "regionalTheme": "warm fertile crescent, inland sea trade",
      "status": "playable",
      "unlockOrder": 10,
      "mapKey": "country/eshvara",
      "peopleProfileId": "people-eshvara"
    },
    {
      "countryId": "country-011",
      "name": "Ruvessa",
      "displayName": "Ruvessa",
      "region": "Avarra Crescent",
      "regionCode": "AVR",
      "flagId": "flag-ruvessa",
      "flagAsset": "assets/flags/flag-ruvessa.svg",
      "identity": "Rain-fed forests and hill roads",
      "regionalTheme": "warm fertile crescent, inland sea trade",
      "status": "playable",
      "unlockOrder": 11,
      "mapKey": "country/ruvessa",
      "peopleProfileId": "people-ruvessa"
    },
    {
      "countryId": "country-012",
      "name": "Dalmor",
      "displayName": "Dalmor",
      "region": "Avarra Crescent",
      "regionCode": "AVR",
      "flagId": "flag-dalmor",
      "flagAsset": "assets/flags/flag-dalmor.svg",
      "identity": "Salt coast and fishing towns",
      "regionalTheme": "warm fertile crescent, inland sea trade",
      "status": "playable",
      "unlockOrder": 12,
      "mapKey": "country/dalmor",
      "peopleProfileId": "people-dalmor"
    },
    {
      "countryId": "country-013",
      "name": "Virelune",
      "displayName": "Virelune",
      "region": "Avarra Crescent",
      "regionCode": "AVR",
      "flagId": "flag-virelune",
      "flagAsset": "assets/flags/flag-virelune.svg",
      "identity": "Large lake basin and observatories",
      "regionalTheme": "warm fertile crescent, inland sea trade",
      "status": "playable",
      "unlockOrder": 13,
      "mapKey": "country/virelune",
      "peopleProfileId": "people-virelune"
    },
    {
      "countryId": "country-014",
      "name": "Qamrith",
      "displayName": "Qamrith",
      "region": "Avarra Crescent",
      "regionCode": "AVR",
      "flagId": "flag-qamrith",
      "flagAsset": "assets/flags/flag-qamrith.svg",
      "identity": "Desert-edge caravan cities",
      "regionalTheme": "warm fertile crescent, inland sea trade",
      "status": "playable",
      "unlockOrder": 14,
      "mapKey": "country/qamrith",
      "peopleProfileId": "people-qamrith"
    },
    {
      "countryId": "country-015",
      "name": "Senvara",
      "displayName": "Senvara",
      "region": "Avarra Crescent",
      "regionCode": "AVR",
      "flagId": "flag-senvara",
      "flagAsset": "assets/flags/flag-senvara.svg",
      "identity": "Constitutional island-facing kingdom",
      "regionalTheme": "warm fertile crescent, inland sea trade",
      "status": "playable",
      "unlockOrder": 15,
      "mapKey": "country/senvara",
      "peopleProfileId": "people-senvara"
    },
    {
      "countryId": "country-016",
      "name": "Torvane",
      "displayName": "Torvane",
      "region": "Avarra Crescent",
      "regionCode": "AVR",
      "flagId": "flag-torvane",
      "flagAsset": "assets/flags/flag-torvane.svg",
      "identity": "Mountain pass and transport center",
      "regionalTheme": "warm fertile crescent, inland sea trade",
      "status": "playable",
      "unlockOrder": 16,
      "mapKey": "country/torvane",
      "peopleProfileId": "people-torvane"
    },
    {
      "countryId": "country-017",
      "name": "Ilvarra",
      "displayName": "Ilvarra",
      "region": "Avarra Crescent",
      "regionCode": "AVR",
      "flagId": "flag-ilvarra",
      "flagAsset": "assets/flags/flag-ilvarra.svg",
      "identity": "Olive-like groves and blue cliffs",
      "regionalTheme": "warm fertile crescent, inland sea trade",
      "status": "playable",
      "unlockOrder": 17,
      "mapKey": "country/ilvarra",
      "peopleProfileId": "people-ilvarra"
    },
    {
      "countryId": "country-018",
      "name": "Meskora",
      "displayName": "Meskora",
      "region": "Avarra Crescent",
      "regionCode": "AVR",
      "flagId": "flag-meskora",
      "flagAsset": "assets/flags/flag-meskora.svg",
      "identity": "Free-trade port federation",
      "regionalTheme": "warm fertile crescent, inland sea trade",
      "status": "playable",
      "unlockOrder": 18,
      "mapKey": "country/meskora",
      "peopleProfileId": "people-meskora"
    },
    {
      "countryId": "country-019",
      "name": "Arqessa",
      "displayName": "Arqessa",
      "region": "Avarra Crescent",
      "regionCode": "AVR",
      "flagId": "flag-arqessa",
      "flagAsset": "assets/flags/flag-arqessa.svg",
      "identity": "Volcanic foothills and mineral fields",
      "regionalTheme": "warm fertile crescent, inland sea trade",
      "status": "playable",
      "unlockOrder": 19,
      "mapKey": "country/arqessa",
      "peopleProfileId": "people-arqessa"
    },
    {
      "countryId": "country-020",
      "name": "Venqara",
      "displayName": "Venqara",
      "region": "Avarra Crescent",
      "regionCode": "AVR",
      "flagId": "flag-venqara",
      "flagAsset": "assets/flags/flag-venqara.svg",